,date,flyer,title,body,url
441,Mie 04.11.2020,Ocho de los 15 modelos top son locales.,Cuáles son los autos nacionales que más se venden,,https://www.clarin.com/economia/autos-venden-modelos-nacionales-compensan-cupos-importacion_0_dG_dMFAvA.html
442,Mar 03.11.2020,Financiamiento.,Martín Guzmán busca al menos $ 1 billón para cerrar las cuentas de acá hasta fin de año,,https://www.clarin.com/economia/martin-guzman-busca-1-billon-cerrar-cuentas-aca-fin-ano_0_KXFVkQhMH.html
443,Mar 03.11.2020,Relevamiento del BBVA.,"Pese al Día de la Madre, el consumo con tarjetas pisó el freno en octubre",,https://www.clarin.com/economia/pese-dia-madre-consumo-tarjetas-piso-freno-octubre_0_PW_U6S_5d.html
444,Mar 03.11.2020,Vuelo alto.,Meli Air: Mercado Libre armó en Brasil su propia flotilla de aviones,,https://www.clarin.com/economia/meli-air-mercado-libre-lanzo-brasil-propia-flotilla-aviones_0_VcRUPnPHe.html
445,Mar 03.11.2020,El frente financiero.,"Para el mercado, el Gobierno acelera plan para calmar el dólar y apura acuerdo con el FMI",,https://www.clarin.com/economia/mercado-gobierno-acelera-plan-calmar-dolar-apura-acuerdo-fmi_0_dE0jelL9a.html
446,Mar 03.11.2020,Foco Económico.,"¿La baja del dólar ""blue"" desanima a los ""coleros virtuales"" y al ""puré""?",,https://www.clarin.com/economia/-baja-dolar-blue-desanima-coleros-virtuales-pure-_0_TOGrqbts9.html
447,Mar 03.11.2020,Dólar.,Otro día de calma cambiaria y el mercado se pregunta: ¿podrá seguir achicándose la brecha?,,https://www.clarin.com/economia/dia-calma-cambiaria-mercado-pregunta-podra-seguir-achicandose-brecha-_0_YXTJKLA0T.html
448,Mar 03.11.2020,Agricultura.,"Basterra presentó el sistema de compensación de retenciones a la soja: ""Estamos cumpliendo con la palabra empeñada por Alberto Fernández""",,https://www.clarin.com/rural/basterra-presento-sistema-compensacion-retenciones-soja-cumpliendo-palabra-empenada-alberto-fernandez-_0_NHgAMVT6F.html
449,Mar 03.11.2020,Elecciones.,Primer inversor y tercer socio comercial: la relación de Argentina con EE.UU. en números,,https://www.clarin.com/economia/primer-inversor-tercer-socio-comercial-relacion-argentina-ee-uu-numeros_0_GI84UqHrm.html
450,Mar 03.11.2020,Mercado cambiario.,El dólar blue bajó a $ 165 y el contado con liqui terminó estable,,https://www.clarin.com/economia/dolar-blue-mantiene-168-contado-liqui-sube-anuncios-martin-guzman_0_wJhwCpgXl.html
451,Mar 03.11.2020,Advertencia.,"Deuda bonaerense: sin acuerdo con Axel Kicillof, los acreedores empiezan a contratar abogados",,https://www.clarin.com/economia/deuda-bonaerense-acuerdo-axel-kicillof-acreedores-empiezan-contratar-abogados_0_D2B1JkFO7.html
452,Mar 03.11.2020,Super cepo.,Dólar ahorro: las diez razones que no te permiten comprarlo,,https://www.clarin.com/economia/dolar-ahorro-razones-permiten-comprarlo_0_F6QXlD7ZX.html
453,Mar 03.11.2020,Indicios para el mercado.,Los economistas ven señales positivas en los últimos anuncios de Guzmán,,https://www.clarin.com/economia/primera-senal-fiscal-ministro-economia-arranco-ajuste-_0_s59WxJuUP.html
454,Mar 03.11.2020,Todos los precios.,Dólar hoy: a cuánto cotizan el oficial y sus diferentes tipos de cambio este martes 03 de noviembre,,https://www.clarin.com/economia/dolar-hoy-cotizan-oficial-diferentes-tipos-cambio-martes-03-noviembre_0_ERdcBQ3Gm.html
455,Mar 03.11.2020,Divisa Internacional.,Dólar blue hoy: a cuánto cotiza este martes 03 de noviembre,,https://www.clarin.com/economia/dolar-blue-hoy-cotiza-martes-03-noviembre_0_hwNngegxV.html
456,Lun 02.11.2020,Reunión en el Palacio de Hacienda.,Los principales empresarios le dijeron a Guzmán que hay que recrear la confianza en el país,,https://www.clarin.com/economia/principales-empresarios-dijeron-guzman-recrear-confianza-pais_0_dpON7M7sz.html
457,Lun 02.11.2020,Documento de Copal.,Dura advertencia de empresarios por los precios máximos: hablan de desabastecimiento,,https://www.clarin.com/economia/dura-advertencia-empresarios-precios-maximos-hablan-desabastecimiento_0_Ibi6fH-gD.html
458,Lun 02.11.2020,Alarma en Misiones.,Un diputado ultra K quiere aplicarle otro impuesto a la yerba mate,,https://www.clarin.com/economia/diputado-ultra-k-quiere-aplicarle-impuesto-yerba-mate_0_m8uR47-Rv.html
459,Lun 02.11.2020,Compensaciones.,Retenciones a la soja: empezarán las prometidas devoluciones a productores de hasta mil toneladas,,https://www.clarin.com/rural/retenciones-soja-empezaran-prometidas-devoluciones-productores-mil-toneladas_0_NdhDUTNvH.html
460,Lun 02.11.2020,Se va antes de fin de año.,Walmart acelera la venta de su cadena y tres grupos empresarios se la disputan,,https://www.clarin.com/economia/walmart-acelera-venta-cadena-3-grupos-empresarios-disputan_0_Mk56O1vnH.html
461,Lun 02.11.2020,El frente financiero.,Señales de Martín Guzmán tranquilizaron el dólar en el arranque del mes y el Banco Central compró US$ 88 millones,,https://www.clarin.com/economia/senales-martin-guzman-tranquilizaron-dolar-arranque-mes-banco-central-compro-us-88-millones_0_F7dh_swNT.html
462,Lun 02.11.2020,Comunicado de la COPAL.,"La industria alimenticia rechazó la extensión de Precios Máximos y advierte que ""pone en riesgo el normal abastecimiento""",,https://www.clarin.com/economia/industria-alimenticia-rechazo-extension-precios-maximos-dice-pone-riesgo-normal-abastecimiento-_0_eQvM6phbK.html
463,Lun 02.11.2020,La relación con Washington.,La Argentina y México bloquearon una reunión clave del BID hasta después de las elecciones en EE.UU.,,https://www.clarin.com/economia/argentina-mexico-bloquearon-reunion-clave-bid-despues-elecciones-ee-uu-_0_8cPMD-mZU.html
464,Lun 02.11.2020,Datos del ministerio de Economía.,"La recaudación de octubre le ganó a la inflación y creció 5,6% en términos reales",,https://www.clarin.com/economia/recaudacion-octubre-gano-inflacion-crecio-5-6-terminos-reales_0_Z_6bJfEb0.html
465,Lun 02.11.2020,Vuelos en pandemia.,"Turismo ""shopping"": 23 aerolíneas extranjeras ya fueron habilitadas",,https://www.clarin.com/economia/turismo-shopping-23-aerolineas-extranjeras-habilitadas_0__jwbDuu49.html
466,Lun 02.11.2020,Agroindustria.,"Tras los dichos de Alberto Fernández, afirman que la soja genera 390.000 puestos de trabajo en el país",,https://www.clarin.com/rural/afirman-soja-genera-390-000-puestos-trabajo-pais_0_1muao6sbe.html
467,Lun 02.11.2020,Mercado cambiario.,Después de tocar los $ 170 el dólar blue vuelve a bajar y cae a  $168,,https://www.clarin.com/economia/dolar-blue-abrio-169-contado-liqui-vuelve-subir_0_edqjfU69y.html
468,Lun 02.11.2020,Pronósticos privados.,La inflación de octubre supera el 3% y le empieza a ganar la carrera al dólar oficial,,https://www.clarin.com/economia/inflacion-octubre-supera-3-empieza-ganar-carrera-dolar-oficial_0_Ys4P8Zr6l.html
469,Lun 02.11.2020,Son US$ 1.715 millones.,En octubre y pese a la baja de las retenciones cayeron las liquidaciones del campo: 4% menos que en septiembre,,https://www.clarin.com/economia/octubre-pese-baja-retenciones-cayeron-liquidaciones-campo-4-septiembre_0_5PlqHKijk.html
470,Lun 02.11.2020,Señal a los mercados.,Guzmán anunció que no pedirá asistencia al Banco Central en lo que queda de 2020,,https://www.clarin.com/economia/guzman-anuncio-pedira-asistencia-banco-central-queda-2020_0_W8P9majKc.html
471,Lun 02.11.2020,Todos los precios.,Dólar hoy: a cuánto cotizan el oficial y sus diferentes tipos de cambio este lunes 02 de noviembre,,https://www.clarin.com/economia/dolar-hoy-cotizan-oficial-diferentes-tipos-cambio-lunes-02-noviembre_0_vLP5kJzeG.html
472,Lun 02.11.2020,Divisa Internacional.,Dólar blue hoy: a cuánto cotiza este lunes 2 de noviembre,,https://www.clarin.com/economia/dolar-blue-hoy-cotiza-lunes-2-noviembre_0_Y1snM-fXR.html
473,Lun 02.11.2020,El clima entre los productores.,Para el campo es mala la gestión del Gobierno y buena la situación del productor,,https://www.clarin.com/economia/campo-mala-gestion-gobierno-buena-situacion-productor_0_8l1Nfn4v-.html
474,Dom 01.11.2020,Entrevista en TV.,Dólar: Martín Guzmán se quejó de los medios y habló de la carta de Cristina Kirchner,,https://www.clarin.com/economia/dolar-martin-guzman-quejo-medios-hablo-carta-cristina-kirchner_0_ugqFbcSNG.html
475,Dom 01.11.2020,Mercado cambiario.,"Dólar ahorro: empieza otro mes de compra de los US$ 200, con menos habilitados y pocas reservas disponibles",,https://www.clarin.com/economia/dolar-ahorro-ventas-solo-us-180-millones-octubre-reservas-siguen-tension_0_WnxYdTx-z.html
476,Dom 01.11.2020,Frente financiero.,Con más deuda en dólares y en pesos Guzmán busca calmar el dólar,,https://www.clarin.com/economia/deuda-dolares-pesos-guzman-busca-calmar-dolar_0_5B-SkdjBf.html
477,Dom 01.11.2020,Comparación interanual.,"Las ventas minoristas cayeron casi 15% en octubre, 5% más respecto a septiembre",,https://www.clarin.com/economia/ventas-minoristas-cayeron-15-octubre-5-respecto-septiembre_0_yV_A-3Hqn.html
478,Dom 01.11.2020,Opinión.,Energía: diez meses de un deterioro persistente,,https://www.clarin.com/economia/energia-meses-deterioro-persistente-_0_doVIy8H4_.html
479,Dom 01.11.2020,Mirada Global.,ANT/Alibaba: la mayor salida a la bolsa del mundo,,https://www.clarin.com/economia/ant-alibaba-mayor-salida-bolsa-mundo_0_z8BEyYN4t.html
480,Dom 01.11.2020,Política energética.,El destino inmediato de Vaca Muerta es petrolero,,https://www.clarin.com/economia/destino-inmediato-vaca-muerta-petrolero_0_4hu0zdIA8.html
481,Dom 01.11.2020,Política cambiaria.,"Gerchunoff: ""Nadie ha logrado resolver el problema de la moneda""",,https://www.clarin.com/economia/gerchunoff-nadie-logrado-resolver-problema-moneda-_0_dCMfgNAI2.html
482,Sab 31.10.2020,El color del dinero.,"Ni carnívoros ni vegetarianos, flexitarianos",,https://www.clarin.com/economia/carnivoros-vegetarianos-flexitarianos_0_81trrejct.html
483,Sab 31.10.2020,Entretelas de la política.,Acuerdismo: la pelota quedó del lado de la oposición,,https://www.clarin.com/economia/acuerdismo-pelota-quedo-lado-oposicion_0_wcdPxkIgm.html
484,Sab 31.10.2020,Escenario.,"Al final, Alberto Fernández hizo con la economía y el dólar lo que el mercado quiso",,https://www.clarin.com/economia/final-alberto-fernandez-hizo-economia-dolar-mercado-quiso_0_96FWCaxhn.html
485,Sab 31.10.2020,La economía que viene.,El dólar encendió otra alarma: en septiembre se agotó el superávit comercial,,https://www.clarin.com/economia/dolar-encendio-alarma-septiembre-agoto-superavit-comercial_0_fsQ456EMI.html
486,Sab 31.10.2020,"Luz, gas y transporte.","En 2021 no habrá recortes de subsidios, pese a los aumentos de tarifas que se vienen",,https://www.clarin.com/economia/2021-recortes-subsidios-pese-aumentos-tarifas-vienen_0_rGVxbvHSo.html
487,Sab 31.10.2020,Ventaja cambiaria.,"Argentina, regalada: los precios en dólares son hasta 70% más baratos que en los países vecinos",,https://www.clarin.com/economia/argentina-vuelve-atractiva-dolar-blue-alto_0_7PsQVSnjQ.html
488,Sab 31.10.2020,Foco Económico.,"Aunque a los empujones, la baja del dólar le da más aire a Guzmán",,https://www.clarin.com/economia/empujones-baja-dolar-da-aire-guzman_0_c0sAUEEBb.html
489,Sab 31.10.2020,Más aperturas.,La AFIP retoma la atención al público en 34 dependencias de la Ciudad y el conurbano,,https://www.clarin.com/economia/afip-retoma-atencion-publico-34-dependencias-ciudad-conurbano_0_IFfNxQ1A_.html
490,Sab 31.10.2020,Panorama de la economía.,La pelea de la semana: el dólar blue contra el festival de bonos,,https://www.clarin.com/economia/pelea-semana-dolar-blue-festival-bonos_0_yFNCJoVM8.html
491,Sab 31.10.2020,Mercado distorsionado.,"Por efecto del dólar blue, las ventas de autos suben por segundo mes en el año",,https://www.clarin.com/economia/efecto-dolar-blue-ventas-autos-suben-segundo-mes-ano_0_elRbWbDi4.html
492,Sab 31.10.2020,Inflación y paritarias.,Habrá un aumento del 7 % para los empleados estatales y volverán a negociar en diciembre,,https://www.clarin.com/economia/aumento-7-empleados-estatales-volveran-negociar-diciembre_0_8s5mhdjm8.html
493,Sab 31.10.2020,Tensión cambiaria.,El repunte del dólar y el miedo a endeudarse dejan al consumo sin aire,,https://www.clarin.com/economia/repunte-dolar-miedo-endeudarse-dejan-consumo-combustible-cara-fin-ano_0_hDopHukPc.html
494,Sab 31.10.2020,RSE en las empresas.,Ayuda desde casa y nuevos proyectos: el voluntariado cambia con la pandemia,,https://www.clarin.com/economia/ayuda-casa-nuevos-destinatarios-voluntariado-cambia-pandemia_0_pY9Yb1B7L.html
495,Sab 31.10.2020,Consumo masivo.,Almacenes y mayoristas recuperan terreno en la guerra de las góndolas,,https://www.clarin.com/economia/almacenes-mayoristas-recuperan-terreno-guerra-gondolas_0_IUGnMp0my.html
496,Vie 30.10.2020,"Cómo quedó ""Casa Nueva"".","""Ladrones comunes estuvieron en nuestro campo"", dijo Etchevehere",,https://www.clarin.com/rural/-ladrones-comunes-campo-dijo-etchevehere_0_9Jj39p0-7.html
497,Vie 30.10.2020,Mercado cambiario.,"Dólar: 3,4 millones de personas compraron hasta los U$S 200 permitidos en septiembre",,https://www.clarin.com/economia/septiembre-3-4-millones-personas-compraron-s-200-permitidos_0_BFuKIH8cz.html
498,Vie 30.10.2020,Nueva Inversión.,Una empresa estadounidense invertirá U$S 45 millones para construir dos barcos pesqueros en Tandanor,,https://www.clarin.com/economia/empresa-estadounidense-invertira-s-45-millones-construir-barcos-pesqueros-tandanor_0_Js6SOLp9h.html
499,Vie 30.10.2020,Mercados financieros.,"Alberto Fernández insiste: en medio de la tensión con el dólar aseguró que ""no habrá devaluación""",,https://www.clarin.com/economia/alberto-fernandez-insiste-medio-tension-dolar-aseguro-devaluacion-_0_aXic-DqZs.html
500,Vie 30.10.2020,Inflación.,El Gobierno extendió Precios Máximos hasta el 31 de enero y los comercios denuncian subas superiores a las autorizadas,,https://www.clarin.com/economia/gobierno-extendio-precios-maximos-31-enero-comercios-denuncian-subas-superiores-autorizadas_0_Ri7MyaB1M.html
501,Vie 30.10.2020,Salud.,Oficializan el aumento a la medicina prepaga: 15% en diciembre y 10% en febrero,,https://www.clarin.com/economia/oficializan-aumento-medicina-prepaga-15-diciembre-10-febrero_0_Mc4FJcq0Q.html
502,Vie 30.10.2020,Coparticipación.,Las transferencias automáticas a las provincias pegaron un salto de 74% en octubre,,https://www.clarin.com/economia/transferencias-automaticas-provincias-pegaron-salto-74-octubre_0_TUj9wjp1X.html
503,Vie 30.10.2020,Alimentos.,"Ni la yerba se salva: tras el récord del inicio de la cuarentena, cae la producción y el consumo",,https://www.clarin.com/economia/yerba-salva-record-inicio-cuarentena-cae-produccion-consumo_0_7Sw-UVcWh.html
504,Vie 30.10.2020,Historia repetida.,"El riesgo país, otra vez en 1.500 puntos: cinco episodios en los que quebró esa barrera",,https://www.clarin.com/economia/riesgo-pais-vez-1-500-puntos-episodios-quebro-barrera_0_xdGuDQ9g5.html
505,Vie 30.10.2020,Mercado cambiario.,Dólar blue: cayó a $ 169 y retrocedió 26 pesos en una semana,,https://www.clarin.com/economia/dolar-blue-nueva-caida-174-gobierno-logra-mantener-baja-semana_0_JweHeyCqJ.html
506,Vie 30.10.2020,Impuestos.,AFIP: prorrogan beneficios para monotributistas y pymes,,https://www.clarin.com/economia/afip-prorrogan-beneficios-monotributistas-pymes_0_h1MkY7RIj.html
507,Vie 30.10.2020,Financiación.,"El ""leasing"", una forma de acceder a bienes de capital en tiempos de crisis",,https://www.clarin.com/economia/leasing-forma-acceder-bienes-capital-tiempos-crisis_0_V0PTxz40y.html
508,Vie 30.10.2020,La situación social.,AUH: postergan los requisitos de salud y escolaridad para cobrar la cuota de 20% de diciembre,,https://www.clarin.com/economia/auh-postergan-requisitos-salud-escolaridad-cobrar-cuota-20-diciembre_0_zg4GcgY2Y.html
509,Vie 30.10.2020,Mercado cambiario.,Los cinco empujones que hicieron que el dólar blue bajara más de 25 pesos en una semana,,https://www.clarin.com/economia/empujones-hicieron-dolar-blue-bajara-20-pesos-semana_0_QM2rMGHKM.html
510,Vie 30.10.2020,Todos los precios.,Dólar hoy: a cuánto cotizan el oficial y sus diferentes tipos de cambio este viernes 30 de octubre,,https://www.clarin.com/economia/dolar-hoy-cotizan-oficial-diferentes-tipos-cambio-viernes-30-octubre_0_u2PkKph75.html
511,Vie 30.10.2020,Son $ 4.127 millones.,Temor a cortes de luz en el verano: el Gobierno está cerca de arreglar una deuda con Edenor y Edesur,,https://www.clarin.com/economia/temor-cortes-luz-verano-gobierno-cerca-arreglar-deuda-edenor-edesur_0_kgHKffzz7.html
512,Vie 30.10.2020,Divisa Internacional.,Dólar blue hoy: a cuánto cotiza este viernes 30 de octubre,,https://www.clarin.com/economia/dolar-blue-hoy-cotiza-viernes-30-octubre_0_3tImsUzBq.html
513,Vie 30.10.2020,Agrodólares.,"Dólares y soja: pese al recorte de retenciones, la liquidación de divisas de octubre fue igual a la de septiembre",,https://www.clarin.com/economia/dolares-soja-pese-recorte-retenciones-liquidacion-divisas-octubre-igual-septiembre_0_IGzRP5sVo.html
514,Vie 30.10.2020,Finanzas personales.,Guía básica de los nuevos bonos de Martín Guzmán: quién y cómo puede invertir,,https://www.clarin.com/economia/guia-basica-nuevos-bonos-guzman-puede-invertir-menu-deuda_0_a6N3I1h9f.html
515,Jue 29.10.2020,Tensión financiera.,Mercados en alerta: el Gobierno quiere saber en tiempo real quiénes compran y venden dolares,,https://www.clarin.com/economia/mercados-alerta-gobierno-quiere-saber-tiempo-real-compra-venden-dolares_0_GE3dZlvPV.html
516,Jue 29.10.2020,Negociación.,"Mauricio Claver-Carone: ""Hay políticas que mandan mensajes equívocos a los mercados""",,https://www.clarin.com/economia/mauricio-claver-carone-politicas-mandan-mensajes-equivocos-mercados-_0_pWra_7Hjy.html
517,Jue 29.10.2020,Transferencias 3.0.,"Habrá un único código QR para pagar con Mercado Pago, tarjetas y billeteras",,https://www.clarin.com/economia/banco-central-crea-nuevo-regimen-impulsar-pagos-moviles_0_V0Ut7wa6t.html
518,Jue 29.10.2020,Energía.,Presupuesto: el bloque del Frente de Todos borró una deuda de $ 30.000 millones que el Gobierno había acordado pagar a las petroleras,,https://www.clarin.com/economia/presupuesto-bloque-frente-borro-deuda-30-000-millones-gobierno-acordado-pagar-petroleras_0_3lK5460Gj.html
519,Jue 29.10.2020,Sector en crisis.,Una de las principales plantas de bioetanol paralizó la producción y suspendió el personal,,https://www.clarin.com/rural/principales-plantas-bioetanol-paralizo-produccion-suspendio-personal_0_KnPkvIy5e.html
520,Jue 29.10.2020,Norma del Banco Central.,Escasez de dólares: qué están ofreciendo las empresas para convencer a sus acreedores de canjear deuda,,https://www.clarin.com/economia/escasez-dolares-ofreciendo-empresas-convencer-acreedores-canjear-deuda_0_QITk4_dQ0.html
521,Jue 29.10.2020,Repercusiones.,Los Etchevehere y dirigentes del campo celebran el fallo que ordenó el desalojo en Entre Ríos,,https://www.clarin.com/rural/etchevehere-dirigentes-campo-celebran-fallo-jueza-castagno_0_bq0AIjUcE.html
522,Jue 29.10.2020,Mercado cambiario.,El dólar blue bajó 20 pesos en cuatro días y retrocedió a $ 175,,https://www.clarin.com/economia/dolar-blue-cae-cuarto-dia-consecutivo-vende-176_0_N2IrUgIUG.html
523,Jue 29.10.2020,Venta por Internet.,Llega la marca de ropa GAP: se venderá solo online,,https://www.clarin.com/economia/medio-crisis-llega-pais-marca-ropa-gap_0_OE0N36nsG.html
524,Jue 29.10.2020,Programa oficial.,Plan previaje 2021: extienden hasta el 15 de noviembre las compras para la temporada de verano,,https://www.clarin.com/economia/plan-previaje-2021-agencias-turismo-piden-prorroga-vender-temporada-verano_0_B5QS83t70.html
525,Jue 29.10.2020,Movimientos.,El nuevo secretario de Energía pone a dos personas de su confianza en la administradora del mercado eléctrico,,https://www.clarin.com/economia/nuevo-secretario-energia-pone-personas-confianza-administradora-mercado-electrico_0_6nXcUR-wL.html
526,Jue 29.10.2020,Todos los precios.,Dólar hoy: a cuánto cotizan el oficial y sus diferentes tipos de cambio este jueves 29 de octubre,,https://www.clarin.com/economia/dolar-hoy-cotizan-oficial-diferentes-tipos-cambio-jueves-29-octubre_0_VRzjzSidL.html
527,Jue 29.10.2020,Nueva medida.,Dólar: el Gobierno quiere saber minuto a minuto quiénes operan en el mercado,,https://www.clarin.com/economia/gobierno-quiere-saber-minuto-minuto-operan-mercado_0_gW0DmpJDb.html
528,Jue 29.10.2020,Divisa Internacional.,Dólar blue hoy: a cuánto cotiza este jueves 29 de octubre,,https://www.clarin.com/economia/dolar-blue-hoy-cotiza-jueves-29-octubre_0_pDPxROGY7.html
529,Jue 29.10.2020,Regularización de deudas.,El Gobierno extiende la moratoria hasta el 30 de noviembre,,https://www.clarin.com/economia/afip-extiende-moratoria-30-noviembre_0_c_N7fsJbo.html
530,Jue 29.10.2020,A dos días de su vencimiento.,El Gobierno aprobó de un tirón las autorizaciones a todas las aerolíneas extranjeras,,https://www.clarin.com/economia/aerolineas-extranjeras-piden-volar-ezeiza-consiguen-autorizacion_0_PcWmnKyjn.html
531,Jue 29.10.2020,Salarios.,El sueldo de la mayoría del personal doméstico registrado es inferior al salario mínimo,,https://www.clarin.com/economia/sueldo-mayoria-personal-domestico-registrado-inferior-salario-minimo_0_RcunMvBjX.html
532,Jue 29.10.2020,Sólo Ezeiza fue habilitado para el cabotaje.,Denuncia penal del gremio de Flybondi por el cierre de El Palomar,,https://www.clarin.com/economia/denuncia-penal-gremio-flybondi-cierre-palomar_0_7WsCl_1I4.html
533,Mie 28.10.2020,Impacto en el bolsillo.,El Gobierno autorizará a las prepagas subir 15% en noviembre y 10% en enero,,https://www.clarin.com/economia/gobierno-autorizara-prepagas-subir-15-noviembre-10-enero_0_ik3TMHeXY.html
534,Mie 28.10.2020,Impuestos.,El gasto en equipamiento que hizo un trabajador en relación de dependencia se puede deducir de Ganancias,,https://www.clarin.com/economia/gasto-equipamiento-hizo-trabajador-relacion-dependencia-puede-deducir-ganancias_0_6_gXx3y60.html
535,Mie 28.10.2020,Mercado de bebidas.,La cervecera CCU anunció inversiones de más de $4500 millones en su planta de Luján,,https://www.clarin.com/economia/cervecera-ccu-anuncio-inversiones-4500-millones-planta-lujan_0_ttez63Tyq.html
536,Mie 28.10.2020,Agroindustria.,Se espera que el sector agrícola ingrese 11.000 millones de dólares en los próximos 5 meses,,https://www.clarin.com/rural/espera-sector-agricola-ingrese-11-000-millones-dolares-proximos-5-meses_0_H_GlqLMEu.html
537,Mie 28.10.2020,Oficial vs Contado con liqui.,Dólar: cuánto le cuesta al Gobierno bajar la brecha cambiaria,,https://www.clarin.com/economia/dolar-cuesta-gobierno-bajar-brecha-cambiaria_0_twjuAjrj8.html
538,Mie 28.10.2020,Más restrictivo.,ATP 7: la asistencia salarial será sólo para sectores críticos,,https://www.clarin.com/economia/atp-7-asistencia-salarial-solo-sectores-criticos_0_B90aW8cJY.html
539,Mie 28.10.2020,Derrumbe bursátil.,Se desploma Wall Street y castiga a las acciones argentinas en Nueva York,,https://www.clarin.com/economia/desploma-wall-street-castiga-acciones-argentinas-nueva-york_0_Ns16bC3i7.html
540,Mie 28.10.2020,Impuesto al cheque.,Mercado Pago informó que ya no será gratis transferir dinero entre cuentas,,https://www.clarin.com/economia/mercado-pago-informo-transferir-dinero-terceros-comision_0_wBdUJHJUM.html
541,Mie 28.10.2020,Mercado cambiario.,Los dólares paralelos siguieron cuesta abajo: el blue cayó a $ 178 y  el contado con liqui perdió 6%,,https://www.clarin.com/economia/dolar-blue-cae-tercer-dia-consecutivo-cotiza-debajo-180_0_Frup1PpNU.html
542,Mie 28.10.2020,Cambios.,AUH: eliminan el tope de 5 hijos menores para cobrar la asignación,,https://www.clarin.com/economia/auh-eliminan-tope-5-hijos-menores-cobrar-asignacion_0_yrecsBo3o.html
543,Mie 28.10.2020,Toma en Entre Ríos.,"Otro documento clave: ""Dolores cedió sus acciones y no tiene nada que ver con el campo de los Etchevehere""",,https://www.clarin.com/rural/-vinculo-dolores-etchevehere-sa-cedio-12-5-aseguro-abogada-mirus_0_U4vAZTvRy.html
544,Mie 28.10.2020,3° ronda.,ProCreAr 2020: se sortean otros 42.000 créditos hipotecarios y personales,,https://www.clarin.com/economia/procrear-2020-sortean-42-000-creditos-hipotecarios-personales_0_1kj062sVi.html
545,Mie 28.10.2020,Todos los precios.,Dólar hoy: a cuánto cotizan el oficial y sus diferentes tipos de cambio este miércoles 28 de octubre,,https://www.clarin.com/economia/dolar-hoy-cotizan-oficial-diferentes-tipos-cambio-miercoles-28-octubre_0_-oODJgi_b.html
546,Mie 28.10.2020,Divisa Internacional.,Dólar blue hoy: a cuánto cotiza este miércoles 28 de octubre,,https://www.clarin.com/economia/dolar-blue-hoy-cotiza-miercoles-28-octubre_0_53Tx0xDmJ.html
547,Mie 28.10.2020,La cadena ganadera.,Las exportaciones de carne crecieron un 13% y generaron 2.000 millones de dólares,,https://www.clarin.com/rural/exportaciones-carne-crecieron-13-generaron-2-000-millones-dolares_0_GWWTMzm_r.html
548,Mie 28.10.2020,Datos de un estudio privado.,Pagos en 3 y 6 cuotas: la nueva táctica para comprar con tarjeta de crédito,,https://www.clarin.com/economia/pagos-3-6-cuotas-nueva-tactica-comprar-tarjeta-credito_0_lVih4h2tM.html
549,Mie 28.10.2020,Sin contacto.,Llegan nuevas tecnologías para sostener la fuerte expansión de los pagos electrónicos,,https://www.clarin.com/economia/llegan-nuevas-tecnologias-sostener-fuerte-expansion-pagos-electronicos_0_3zNico9Zw.html
550,Mie 28.10.2020,Contradicciones.,El Gobierno pagará a las petroleras una deuda millonaria por la devaluación de 2018,,https://www.clarin.com/economia/desacuerdos-gobierno-pagar-gas-anterior-futuro_0_Q4i3d-0G4.html
551,Mar 27.10.2020,,Anuncian la incorporación de 720.000 chicas y chicos más a la Asignación Universal por Hijo,,https://www.clarin.com/economia/anuncian-incorporacion-720-000-chicas-chicos-asignacion-universal-hijo_0_d6ltS8ujN.html
